{
  "decisionId": "PD-ILLUSTRATIVE-001",
  "type": "gaam-promotion-decision",
  "gaamVersion": "0.9.0",
  "candidateId": "PC-ILLUSTRATIVE-001",
  "decision": "deferred",
  "decidedBy": {
    "authority": "GAAM maintainers under GOVERNANCE.md",
    "scope": "Repository governance disposition for an illustrative promotion record only."
  },
  "decidedAt": "2026-08-11",
  "evidence": [
    "governance/promotion/examples/illustrative-promotion.json"
  ],
  "releaseImpact": "commit-only",
  "targetVersion": null,
  "conditions": [
    "Obtain independent implementation and review evidence before normative consideration."
  ],
  "supersessionOrRollback": "This illustrative decision may be replaced only by another synthetic example and has no effect on GAAM conformance.",
  "rationale": "The example intentionally demonstrates that incomplete gates result in deferral rather than normative adoption."
}
